{ "format": "night-roll-annotations", "version": 2, "song": "prologue", "origin": {"kind":"capture"}, "notes": [
  {"at":[1,1],"to":[1,2],"type":"chord","chord":"F5"},
  {"at":[1,1],"type":"key","key":"F"},
  {"at":[1,3],"to":[1,4],"type":"chord","chord":"C/E"},
  {"at":[2,1],"to":[2,2],"type":"chord","chord":"Bb/D"},
  {"at":[2,3],"to":[2,4],"type":"chord","chord":"Am7/C"},
  {"at":[3,1],"to":[3,2],"type":"chord","chord":"Bb"},
  {"at":[3,3],"to":[3,4],"type":"chord","chord":"G"},
  {"at":[3,3],"text":"This G maj has no 5th"},
  {"at":[3,3],"to":[3,4],"type":"chord","chord":"G7/B","note":"no 5th"},
  {"at":[4,1],"to":[4,2],"type":"chord","chord":"Fsus4/C"},
  {"at":[4,3],"to":[4,4],"type":"chord","chord":"C"},
  {"at":[5,1],"to":[5,2],"type":"chord","chord":"Gm/Bb"},
  {"at":[5,3],"to":[5,4],"type":"chord","chord":"D/A","note":"The D comes in After the onset. This court was ambiguous from the two notes at the onset F sharp and aIt tookReading further intoThe bar to be able to understandThe cord"},
  {"at":[6,1],"to":[6,2],"type":"chord","chord":"Gm"},
  {"at":[6,3],"to":[6,4],"type":"chord","chord":"Gb"},
  {"at":[7,1],"to":[7,2],"type":"chord","chord":"Gm"},
  {"at":[7,3],"to":[7,4],"type":"chord","chord":"G7/F"},
  {"at":[8,1],"to":[8,2],"type":"chord","chord":"Am/E"},
  {"at":[8,3],"to":[8,4],"type":"chord","chord":"C7"},
  {"at":[9,1],"to":[9,2],"type":"chord","chord":"F5"}
] }
